{"schema_version":1,"ratio_buckets":["1:2","1:1","2:1"],"die_faces":6,"results":{"1:2":[{"_placeholder":true},{"_placeholder":true},{"_placeholder":true},{"_placeholder":true},{"_placeholder":true},{"_placeholder":true}],"1:1":[{"_placeholder":true},{"_placeholder":true},{"_placeholder":true},{"_placeholder":true},{"_placeholder":true},{"_placeholder":true}],"2:1":[{"_placeholder":true},{"_placeholder":true},{"_placeholder":true},{"_placeholder":true},{"_placeholder":true},{"_placeholder":true}]}}
